<?xml version="1.0" encoding="utf-8"?>
<!DOCTYPE warehouse SYSTEM "Warehouse.dtd">
<warehouse name="Humanoid Containment Site-06-3">
	<info>
		<manager>Dr. Mahong</manager>
		<location>Site-06-3</location>
	</info>
	
	<inbound>
		<product>
			<id>8</id>
			<name>SCP-1388</name>
			<amount>5</amount>
		</product>
	</inbound>
	
	<outbound>	
	</outbound>
	
	<storage> 
		<product>
			<id>1</id>
			<name>SCP-069</name>
			<amount>1</amount>
		</product>
		<product>
			<id>2</id>
			<name>SCP-706</name>
			<amount>1</amount>
		</product>
		<product>
			<id>3</id>
			<name>SCP-1669</name>
			<amount>1</amount>
		</product>
		<product>
			<id>4</id>
			<name>SCP-1702</name>
			<amount>1</amount>
		</product>
		<product>
			<id>21</id>
			<name>SCP-931</name>
			<amount>5</amount>
		</product>
	</storage>
</warehouse>